{
  "id": "navsim-yourmethod-r34",
  "benchmarkId": "navsim",
  "method": "YourMethod (R34)",
  "team": "Your Lab",
  "split": "NAVSIM benchmark",
  "score": 0.0,
  "status": "pending",
  "date": "2026-09-23",
  "paper": "https://arxiv.org/abs/0000.00000",
  "code": "https://github.com/your-org/your-repo",
  "evidence": "https://github.com/your-org/your-repo/blob/main/EVALUATION.md",
  "notes": "Describe the model configuration, sensors, training data, checkpoint, and evaluation command."
}

